{
  "name": "artifact-example-check",
  "description": "Use when maintaining schema examples for public harness artifacts.",
  "lifecycle_stage": "VERIFY",
  "trigger": "A schema is added or changed and agents need a concrete valid example.",
  "inputs": [
    "schema file",
    "matching template",
    "current validation output"
  ],
  "procedure": [
    "Create or update the matching example artifact.",
    "Validate the example against the schema.",
    "Run the repository quality gate."
  ],
  "anti_rationalization": [
    "Do not assume prose examples are enough when a schema exists."
  ],
  "when_not_to_use": [
    "Do not use this for runtime behavior that needs a real-runtime smoke artifact instead of a static schema example."
  ],
  "verification": [
    "python scripts/validate_repo.py"
  ],
  "output_artifact": "Valid JSON example artifact that matches the published schema and template contract.",
  "failure_modes": [
    "Example omits required schema fields.",
    "Example adds fields not allowed by the closed schema."
  ],
  "examples": [
    "Add examples/artifacts/handoff-report.example.json for schemas/handoff-report.schema.json."
  ]
}
